status,brand,model,year,category,price_cop,engine_cc,power_hp,weight_kg,fuel_efficiency,experience_level,use_case,image_url,description,tags,source_url,notes
loaded,KTM,RC 200,2024,sport,23000000,200,25,137,30.0,beginner,urban,https://placehold.co/600x400?text=KTM+RC+200,"Deportiva pequeña ideal para iniciarse en el mundo sport, ágil y económica para la ciudad.",deportiva;ágil;económica,https://www.ktmviamotos.com/es-co/models/supersport/2024-ktm-rc-200.html,Precio estimado 2024 con base en valor 2022 (19.59M+IVA); verificar con concesionario.
loaded,Honda,Rebel 500,2024,cruiser,42590000,471,46,191,25.0,intermediate,urban,https://placehold.co/600x400?text=Honda+Rebel+500,"Cruiser moderna de cilindraje medio, cómoda y de manejo suave para uso urbano diario.",cómoda;clásica;versátil,https://motos.honda.com.co/motos-honda/custom/CMX-500,
loaded,Honda,NC750X,2024,touring,54990000,745,58,223,28.0,intermediate,urban,https://placehold.co/600x400?text=Honda+NC750X,"Trail versátil con gran autonomía y espacio de almacenamiento, perfecta para ciudad y carretera.",versátil;eficiente;práctica,https://www.revistaturbo.com/honda-nc750x-2025-precio-caracteristicas-col/,Precio del modelo 2025 lanzado en Colombia.
loaded,Honda,XR150L,2024,offroad,11130000,150,12,127,45.0,beginner,urban,https://placehold.co/600x400?text=Honda+XR150L,"Moto todoterreno liviana y económica, ideal para principiantes que combinan ciudad y trocha.",económica;versátil;confiable,https://comotos.co/honda-xr-150l-precio-ficha-tecnica-y-caracteristicas/,
loaded,Triumph,Street Triple RS,2024,naked,70000000,765,130,166,18.0,advanced,urban,https://placehold.co/600x400?text=Triumph+Street+Triple+RS,"Naked premium de alto rendimiento con suspensión Showa y Öhlins, pensada para riders experimentados.",premium;potente;tecnológica,https://triumphcolombia.com/motos/roadsters/street-triple-rs-765/,
loaded,KTM,890 Adventure R,2024,adventure,85000000,889,105,212,20.0,advanced,offroad,https://placehold.co/600x400?text=KTM+890+Adventure+R,"Adventure de alta cilindrada con suspensión de largo recorrido, diseñada para terrenos exigentes.",robusta;todoterreno;potente,https://articulo.tucarro.com.co/MCO-1412633703-ktm-890-adventure-r-_JM,Precio estimado con base en listado usado (83.99M); verificar precio nuevo con concesionario.
loaded,Yamaha,XMAX 300,2024,scooter,34000000,292,28,179,35.0,beginner,highway,https://placehold.co/600x400?text=Yamaha+XMAX+300,"Scooter de gran tamaño con potencia suficiente para carretera, cómoda y con tecnología avanzada.",cómoda;tecnológica;potente,https://www.incolmotos-yamaha.com.co/vehiculo/xmax300/9603/,Precio corresponde al modelo más reciente (2026) listado por el concesionario oficial.
loaded,Kawasaki,Ninja ZX-6R,2024,sport,75000000,636,127,196,16.0,advanced,highway,https://placehold.co/600x400?text=Kawasaki+Ninja+ZX-6R,"Supersport de media cilindrada con motor de 4 cilindros, ideal para riders avanzados en carretera.",deportiva;potente;ágil,https://www.auteco.com.co/kawasaki-ninja-zx-6r/p,"Precio nuevo estimado; oficial no publicado, rango de usados 64.5M-82M COP."
